<?xml version="1.0" encoding="UTF-8"?>
<ar:sok xmlns:ar="http://www.arkivverket.no/standarder/noark5/sok"
    xmlns:xsi="http://www.w3.org/2001/XMLSchema-instance"
    xsi:schemaLocation="http://www.arkivverket.no/standarder/noark5/arkivmelding file:./sok.xsd">
    <ar:system>system0</ar:system>
    <ar:meldingId>meldingId0</ar:meldingId>
    <ar:tidspunkt>2006-05-04T18:13:51.0</ar:tidspunkt>
    <ar:take>10</ar:take>
    <ar:skip>10</ar:skip>
    <ar:respons>mappe</ar:respons>
    <ar:parameter>
        <ar:felt>sak.klassifikasjonssystem</ar:felt>
        <ar:operator>equal</ar:operator>
        <ar:parameterverdier>
            <ar:klassifikasjonvalues>
                <ar:klassifikasjonssystem>GBNR</ar:klassifikasjonssystem>
                <ar:klasse>21/400</ar:klasse>
            </ar:klassifikasjonvalues>
        </ar:parameterverdier>
    </ar:parameter>    
</ar:sok>