<?xml version="1.0" encoding="UTF-8"?>
<ar:sok xmlns:ar="http://www.arkivverket.no/standarder/noark5/sok"
    xmlns:xsi="http://www.w3.org/2001/XMLSchema-instance"
    xsi:schemaLocation="http://www.arkivverket.no/standarder/noark5/arkivmelding file:./sok.xsd">
    <ar:system>system0</ar:system>
    <ar:meldingId>meldingId0</ar:meldingId>
    <ar:tidspunkt>2006-05-04T18:13:51.0</ar:tidspunkt>
    <ar:take>100</ar:take>
    <ar:skip>0</ar:skip>
    <ar:respons>journalpost</ar:respons>
    <ar:parameter>
        <ar:felt>registrering.tittel</ar:felt>
        <ar:operator>equal</ar:operator>
        <ar:parameterverdier>
            <ar:stringvalues>
                <ar:value>Kaffeavtale*</ar:value>
            </ar:stringvalues>
        </ar:parameterverdier>
    </ar:parameter>
    <ar:parameter>
        <ar:felt>journalpost.journalposttype</ar:felt>
        <ar:operator>equal</ar:operator>
        <ar:parameterverdier>
            <ar:stringvalues>
                <ar:value>I</ar:value>
            </ar:stringvalues>
        </ar:parameterverdier>
        </ar:parameter>
    <ar:parameter>
        <ar:felt>registrering.eksternId</ar:felt>
        <ar:operator>equal</ar:operator>
        <ar:parameterverdier>
            <ar:eksternId>
                <ar:system>SikriElements</ar:system>
                <ar:id>85295a5e-6415-410c-8a2c-5b368f1ed06c</ar:id>
            </ar:eksternId>
        </ar:parameterverdier>
    </ar:parameter>
    <ar:parameter>
        <ar:felt>journalpost.journaldato</ar:felt>
        <ar:operator>between</ar:operator>
        <ar:parameterverdier>
            <ar:datevalues>
                <ar:value>2006-05-04T18:13:51.0</ar:value>
                <ar:value>2016-05-04T18:13:51.0</ar:value>
            </ar:datevalues>
        </ar:parameterverdier>
    </ar:parameter>
</ar:sok>